{
  "schemaVersion": "a0.corpus-manifest.v1",
  "corpusId": "synthetic-vector-contract-example-v1",
  "approvalState": "contract-example",
  "qualityDecision": "not-evaluated",
  "assetStoragePolicy": "no-image-blobs-anonymous-references-only",
  "rightsRecordId": "rights-self-authored-vector-v1",
  "oracleId": "oracle-vector-contract-v1",
  "splitPolicies": [
    { "split": "calibration", "purpose": "profile-calibration", "accessRule": "engineering-visible", "mutable": true, "mayTuneProduct": true },
    { "split": "development", "purpose": "implementation-development", "accessRule": "engineering-visible", "mutable": true, "mayTuneProduct": true },
    { "split": "locked-holdout", "purpose": "blind-acceptance-evaluation", "accessRule": "blind-until-evaluation", "mutable": false, "mayTuneProduct": false },
    { "split": "release", "purpose": "release-confirmation", "accessRule": "release-only", "mutable": false, "mayTuneProduct": false }
  ],
  "entries": [
    { "fixtureId": "vector-calibration-grid", "split": "calibration", "assetId": "asset-calibration-grid", "assetKind": "SelfAuthoredVectorSpec", "artifactPath": "samples/public/corpus-contracts/vector-specs/calibration-grid.json", "externalObjectId": null, "contentSha256": "5351fb55f04db85059feb8741373b12f54b2a26305c7024564af4c016df1f323", "rightsRecordId": "rights-self-authored-vector-v1", "oracleId": "oracle-vector-contract-v1", "groups": { "originalMasterGroupId": "master-calibration-grid", "captureSessionGroupId": "not-captured-calibration", "rigStateGroupId": "not-applicable-calibration", "derivationFamilyId": "family-calibration-grid" }, "captureCondition": null, "expectedOutcome": { "outcome": "Accept", "failureCode": null }, "imageBlobCommitted": false, "hardwareEvidence": false, "qualityDecision": "not-evaluated" },
    { "fixtureId": "vector-development-seam", "split": "development", "assetId": "asset-development-seam", "assetKind": "SelfAuthoredVectorSpec", "artifactPath": "samples/public/corpus-contracts/vector-specs/development-seam.json", "externalObjectId": null, "contentSha256": "cd280738ecd1c10346f308f3c96c0a2454756a0b14533fb38cdd11d99f62e2df", "rightsRecordId": "rights-self-authored-vector-v1", "oracleId": "oracle-vector-contract-v1", "groups": { "originalMasterGroupId": "master-development-seam", "captureSessionGroupId": "not-captured-development", "rigStateGroupId": "not-applicable-development", "derivationFamilyId": "family-development-seam" }, "captureCondition": null, "expectedOutcome": { "outcome": "Accept", "failureCode": null }, "imageBlobCommitted": false, "hardwareEvidence": false, "qualityDecision": "not-evaluated" },
    { "fixtureId": "vector-development-seam-damaged", "split": "development", "assetId": "asset-development-seam-damaged", "assetKind": "SelfAuthoredVectorSpec", "artifactPath": "samples/public/corpus-contracts/vector-specs/development-seam-damaged.json", "externalObjectId": null, "contentSha256": "5de1a42e3f533e170acb25858398bd3f05aa8a552bcb4d7c5344fcf94ded0b87", "rightsRecordId": "rights-self-authored-vector-v1", "oracleId": "oracle-vector-contract-v1", "groups": { "originalMasterGroupId": "master-development-seam", "captureSessionGroupId": "not-captured-development", "rigStateGroupId": "not-applicable-development", "derivationFamilyId": "family-development-seam" }, "captureCondition": null, "expectedOutcome": { "outcome": "Reject", "failureCode": "declared-damage-detected" }, "imageBlobCommitted": false, "hardwareEvidence": false, "qualityDecision": "not-evaluated" },
    { "fixtureId": "vector-locked-holdout-edge", "split": "locked-holdout", "assetId": "asset-locked-holdout-edge", "assetKind": "SelfAuthoredVectorSpec", "artifactPath": "samples/public/corpus-contracts/vector-specs/locked-holdout-edge.json", "externalObjectId": null, "contentSha256": "61f42068842760039d3423266f2dc1a294fc65ac88b711784b7d2145f4f02955", "rightsRecordId": "rights-self-authored-vector-v1", "oracleId": "oracle-vector-contract-v1", "groups": { "originalMasterGroupId": "master-holdout-edge", "captureSessionGroupId": "not-captured-holdout", "rigStateGroupId": "not-applicable-holdout", "derivationFamilyId": "family-holdout-edge" }, "captureCondition": null, "expectedOutcome": { "outcome": "Accept", "failureCode": null }, "imageBlobCommitted": false, "hardwareEvidence": false, "qualityDecision": "not-evaluated" },
    { "fixtureId": "vector-release-layout", "split": "release", "assetId": "asset-release-layout", "assetKind": "SelfAuthoredVectorSpec", "artifactPath": "samples/public/corpus-contracts/vector-specs/release-layout.json", "externalObjectId": null, "contentSha256": "884c0b15dbbb442ac743e4226b3c31f87a8619d90945b7bbb6609f8d09c1bfc6", "rightsRecordId": "rights-self-authored-vector-v1", "oracleId": "oracle-vector-contract-v1", "groups": { "originalMasterGroupId": "master-release-layout", "captureSessionGroupId": "not-captured-release", "rigStateGroupId": "not-applicable-release", "derivationFamilyId": "family-release-layout" }, "captureCondition": null, "expectedOutcome": { "outcome": "Accept", "failureCode": null }, "imageBlobCommitted": false, "hardwareEvidence": false, "qualityDecision": "not-evaluated" },
    { "fixtureId": "vector-pilot-chart-development", "split": "development", "assetId": "asset-pilot-chart-development", "assetKind": "SelfAuthoredVectorSpec", "artifactPath": "samples/public/corpus-contracts/vector-specs/pilot-chart-development-v1.json", "externalObjectId": null, "contentSha256": "d9fbbd767ca9d7f879b9fac5071326b0477340a58a80131f6c448ba66e8f9f4f", "rightsRecordId": "rights-self-authored-vector-v1", "oracleId": "oracle-vector-contract-v1", "groups": { "originalMasterGroupId": "master-pilot-chart-development", "captureSessionGroupId": "not-captured-pilot-chart-development", "rigStateGroupId": "not-applicable-pilot-chart-development", "derivationFamilyId": "family-pilot-chart-development" }, "captureCondition": null, "expectedOutcome": { "outcome": "Accept", "failureCode": null }, "imageBlobCommitted": false, "hardwareEvidence": false, "qualityDecision": "not-evaluated" },
    { "fixtureId": "vector-pilot-chart-holdout", "split": "locked-holdout", "assetId": "asset-pilot-chart-holdout", "assetKind": "SelfAuthoredVectorSpec", "artifactPath": "samples/public/corpus-contracts/vector-specs/pilot-chart-holdout-v1.json", "externalObjectId": null, "contentSha256": "5ea04ffcb95886bb784484fbe6bdd5b122bdf9d8f057d332ee33c37a4ce62b5d", "rightsRecordId": "rights-self-authored-vector-v1", "oracleId": "oracle-vector-contract-v1", "groups": { "originalMasterGroupId": "master-pilot-chart-holdout", "captureSessionGroupId": "not-captured-pilot-chart-holdout", "rigStateGroupId": "not-applicable-pilot-chart-holdout", "derivationFamilyId": "family-pilot-chart-holdout" }, "captureCondition": null, "expectedOutcome": { "outcome": "Accept", "failureCode": null }, "imageBlobCommitted": false, "hardwareEvidence": false, "qualityDecision": "not-evaluated" }
  ]
}
